"id","created_at","texte","suicide"
"1465599508847288325","1465599508847288325","A warm welcome to the new CEO of Twitter (gotta love the Baniya Power in the house <U+0001F44A><U+0001F3FC>) #tothemoon #twitterCEO #ParagAgarwal #Twitter #ParagAgrawal (there's just too many spellings of our name lol)",FALSE
"1465642683347709962","1465642683347709962","A well-deserved ratio, here ",FALSE
"1465618652531679233","1465618652531679233","AC Milan 1-3 Sassuolo: Five things we learned #tips #tipster #bets #freetips #sportsbetting #betting #inplay #news #times link &amp; Copyright for syndicated content belongs to the source link From url Source ",FALSE
"1465618624127795203","1465618624127795203","AFRICA/NIGER - ""The difficult road to the border"": growing threats against Christian communities ",FALSE
"1465600233828765699","1465600233828765699","ALL OF THEM GENUINELY SOUND SO GOOD IM SO HAPPY",FALSE
"1465618703060549635","1465618703060549635","AMC and Sony to Gift NFTs to ‘Spider-Man: No Way Home’ Advance Opening Ticket Buyers – Bitcoin News ",FALSE
"1465618700132835328","1465618700132835328","AMC and Sony to Gift NFTs to ‘Spider-Man: No Way Home’ Advance Opening Ticket Buyers – Bitcoin News ",FALSE
"1465618684051959808","1465618684051959808","AOC is working hard for us all, and has taken a lot of undeserved criticism - Contact: 216 Cannon HOB, Washington, DC  20515 - 74-09 37th Ave., Ste 305, Jackson Heights, NY  11372 - 1973 Westchester Ave.The Bronx, NY  10462 - News: ",FALSE
"1465618633028104194","1465618633028104194","ASIA - Myanmar and Afghanistan: far, very close ",FALSE
"1465618395886329859","1465618395886329859","According to the UNICEF survey, 80% of young people surveyed said they had heard of climate change; only 56% could define it for what it is#climatechange #ClimateAction ",FALSE
"1465634304172572678","1465634304172572678","According to this cutoff grade, the paper has calculated the ratio of ore and rock while cutoff drawing that provide science fo…",FALSE
"1465064090490089480","1465064090490089480","Adventure VS. Modern Sonic Style Guide ComparisonBeen meaning to make this for a long time now. Many people consider the only major Sonic design change to lie within the Classic to Adventure transition. I disagree! Please feel free to use this as reference for your art! ",FALSE
"1465184636770914304","1465184636770914304","Afam and his apostles should respond.I wonder how they'll feel about an Igbo man who's a provider to an Igbo woman born in the abroad...and also cooks on top.",FALSE
"1465618419252822017","1465618419252822017","After more than a year, the will become operational round-the-clock from Wednesday onwards.#Aviation ",FALSE
"1465649361329795077","1465649361329795077","After projecting 181.5 million combined planted acres of #corn &amp; #soybeans in 2022, used a break-even futures base ratio of 2.3 &amp; projected 96 million acres of planted corn and 85.5 million acres of planted soybeans for 2022 in Monday's webinar (clip, 2 minutes). ",FALSE
"1465599514224435202","1465599514224435202","After so long then I have a Sunday off !!! I’m so happy !!",FALSE
"1465618519270121472","1465618519270121472","After stopping a car with a police sticker, the students complained that the driver introduced himself as a police officer but was unable to show a driver's license or the vehicle's fitness paper.#Bangladesh ",FALSE
"1465598804451807237","1465598804451807237","Ah happy bastard day",FALSE
"1465165066857172998","1465165066857172998","Airdrop for 20,000 Winners!<U+0001F381>PRIZE<U+0001F381>1,000 $CRTS20,000 WINNERS<U+0001F4E2>RULES<U+0001F4E2>Follow &amp; RT Mention 3 people in the commentTG TG channel: The submission form is available on the TG channel#Airdrop #CRTS #BSC #ETH ",FALSE
"1465542308070191110","1465542308070191110","Airdrop live now <U+0001F389><U+0001F389>- Follow us : _sol- Like, Quote tweet + hastag #SolanaAirdrop #SOL $WANU + tag 5 friends.- Join Discord :  - Proff your tweet and address on DiscordFirst 2000 Members will get $WANU coin Airdrop. $WANU #Solana #Airdrop",FALSE
"1465618240521003010","1465618240521003010","Airport diaries: Deepika Padukone aces denim on denim look | Hindi Movie News – Bollywood – Times of India ",FALSE
"1465641663951523846","1465641663951523846","Alas, poor bar. I knew him, a ratio. ",FALSE
"1465324850017456134","1465324850017456134","Alright let's settle this once and for all. Who is the definitive music twt contrarian.",FALSE
"1465618239757631492","1465618239757631492","Always great to have some good news whilst on vacation.",FALSE
"1465607165436063749","1465607165436063749","Amprobe - 4109575 IR-720 Infrared Thermometer with 201 Spot Ratio eBay",FALSE
"1465599694583832581","1465599694583832581","And the constant everything else I just want to be happy that’s all I’ve ever wanted figure out my sister saying when I came back from California she said you are supposed to be dead and hasn’t spoken to me cents",FALSE
"1465633381031555080","1465633381031555080","Another bad day for the Sharpe ratio of some fund managers with reduced exposure to bonds because they jumped on the inflation bandwagon. $SPX $TLT",FALSE
"1465618479269224448","1465618479269224448","Another country that recently got into a grudge with China was the Solomon Islands, right? Wonder why China's still concentrating fire on Lithuania. In terms of news popularity, the riots in the island nation should be more dramatic, no? ",FALSE
"1465599153350881282","1465599153350881282","Another month gone! Check your #Sales, #Marketing and #BusinessGoals for last month. If not happy then you need to contact me for a free initial #mentoring session.",FALSE
"1465598982764187648","1465598982764187648","Ansar Abbasi is going to explode on GC Lahore and this whole Harry Potter thing. Man can't take anyone being happy.",FALSE
"1456422747991543846","1456422747991543846","Any political party that will not take immediate action on climate change to save humanity should be classed as a terrorist organization &amp; threat to humankind. Fossil fuel companies should be deemed Weapons of Mass Destruction (WMD) to the planet &amp; curtailed. ",FALSE
"1465603755517304832","1465603755517304832","Anybody have a good ratio for making Pilk? Also is whole milk better, or should I opt for like 2%?",FALSE
"1465617444823830528","1465617444823830528","Anyone is more then welcomed to tweet at me about any of my video asking what the like to disliked ratio is, I’m happy to show you as doesn’t want to",FALSE
"1465599247726694400","1465599247726694400","Anyone? <U+2727>                                                      <U+2727>            Put this on your profile            and who feels happy               to be your mutual                    will reply<U+2727>                                                       <U+2727>",FALSE
"1465599376173240323","1465599376173240323","Apologies for the RTs to the timeline, but I'm just pretty pleased to see Devs happy for their hard work being recognised <U+263A><U+FE0F>",FALSE
"1465623406620160000","1465623406620160000","Are you aware of how important the H/Q ratio is? We have summed up some important knowledge about the relation between the hamstring and quadriceps muscles related to hamstring injuries. Get insights here<U+0001F447>#physio #footballstories #injuries ",FALSE
"1457577465426051072","1457577465426051072","Are you ready for the biggest nft game in the crypto industry.#ELEFWORLD #ELEFARMY#NFTGAME #P2E #NEXTGEM #FAIRLAUNCH #BINANCESMARTCHAIN ",FALSE
"1423799557255802883","1423799557255802883","Are you transgender, an ally, or just want to hang out with trannies for some reason? Do you hate radical leftism and woke puritanism, especially that dominates online trans communities?Come join Trans But No Commies, a discord server ran by me!",FALSE
"1465618330425995270","1465618330425995270","Arjun Sarja, accused in sexual misconduct case by actress Sruthi Hariharan, gets clean chit by police | Regional News ",FALSE
"1465618331558244355","1465618331558244355","Art Industry News: Damien Hirst Has Now Minted 10,000 NFTs Based on That Viral Drake Album Cover He Designed + Other Stories - artnet News#crypto #cryptoartist #nftnews #crypto #Cryptonews  #NFT #NFTs #NFTdrop #nftart #nftcollector #NFTCommunity",FALSE
"1465618209357418496","1465618209357418496","Art Industry News: Damien Hirst Has Now Minted 10,000 NFTs Based on That Viral Drake Album Cover He Designed + Other Stories | Artnet News ",FALSE
"1465618283726524420","1465618283726524420","Artificial intelligence has probably already made decisions about you. Here's why that matters - ABC News | ",FALSE
"1465618616892760070","1465618616892760070","Arvind Kejriwal Questions 'Delay' in Banning International Flights Amid Omicron Threat Kejriwal had on Sunday urged Prime Minister Narendra Modi to stop flights coming to India from countries affected by the new variant w... #India by #News18 ",FALSE
"1465600173459927042","1465600173459927042","As an artist, i love drawing complicated designs but goddamn i just cannot draw Kaeya's clothes. Happy birthday #kaeya !",FALSE
"1465600255643336707","1465600255643336707","As happy a man as any in the world  for the whole May your day be as bright as you make mine A happy<U+0627><U+0646><U+0633><U+062E> ""NBF150""",FALSE
"1465599593350144004","1465599593350144004","As much as I’d like Ferret.crypto - $8000 for pleasure seems a little profligate to put it mildly … happy for front runners to buy it and then sell it to me at a loss when the run is over … I’ll be waiting … <U+0001F923> ",FALSE
"1465600055147065351","1465600055147065351","As soon as i get a bit happy kisi ko problem ho jati hai lol go off",FALSE
"1465618229657804801","1465618229657804801","As you know I love to take the piss out of my Twitter chum , but as she had some very sad news I am trying to be nice..so...that in mind!! ",FALSE
"1465649040536879106","1465649040536879106","Aspiring ratio artist <U+0001F4AA><U+0001F4AA><U+0001F4AA>",FALSE
"1465626562452201472","1465626562452201472","At 83.58 WFG trades on a PE of 3.1 and and an FCF to EV ratio of 3.3 percent.",FALSE
"1465618238855909377","1465618238855909377","At the moment msm has had its monopoly power reduced.While they continue to produce same old same old the new kid on the block, GB News,is gaining much ground ratingswise with nigels nightly ramble. Well done GB NEWS but you have more to do.E.G. Participants all talking at once!",FALSE
"1465636958009368577","1465636958009368577","At this time, sell gold has a good profit loss ratio, so be bold ",FALSE
"1445118754225106957","1445118754225106957","Attention! Many claims that high #phthalates in consumer products cause health issues are unfounded. Get the facts. ",FALSE
"1465618268845182982","1465618268845182982","BBC Strictly Come Dancing: Star rushed to hospital after health scare #driving #news",FALSE
"1465615655579881475","1465615655579881475","BREAKING NEWS | Stats SA has announced that South Africa’s #unemployment rate increased by 0,5 of a percentage point to 34,9% in the third quarter of 2021 compared to the second quarter. ",FALSE
"1465618366513790976","1465618366513790976","BREAKING! UPDF, DRC army launch air raids against ADF camps in DRC#KampalaReport #ADF #DRC#UPDF #easternCongo ",FALSE
"1465618410990100482","1465618410990100482","BREAKING! UPDF, DRC army launch air raids against ADF camps in DRC#KampalaReport #ADF #DRC#UPDF #easternCongo ",FALSE
"1465618521413541889","1465618521413541889","BREAKING: Uganda says it launched joint raids with DRC against ADF ",FALSE
"1465599780264939523","1465599780264939523","Back to cycling after a while. Short ride but happy to get some speed going. ",FALSE
"1465618362776625154","1465618362776625154","Bajaj Holdings  rises  1.65% as Sensex  climbs The stock traded at a P/E multiple of 13.91, while the price-to-book value ratio stood at 0.99. #Market by #EconomicTimes ",FALSE
"1465618497187106816","1465618497187106816","Balearic boost for buyers browsing online – Mallorca tops the chart in 2021 property searches ",FALSE
"1465599229666148353","1465599229666148353","Ball after ball video tree.. its new yall mixed up and happy. NFL weeks is up higher than yall decisions. I'm up up.. yall can't even type the shit up. Focus on medical or keep dreaming about teeth. Wahpeton",FALSE
"1465471598929002507","1465471598929002507","Ballon D’Or award ? Hard to take seriously. Sorry.",FALSE
"1465618331583623176","1465618331583623176","Ballon d’Or: German papers lead backlash at Lionel Messi being handed ‘absolutely undeserved’ title ",FALSE
"1465618610550816770","1465618610550816770","Bangladesh town elects country’s first transgender mayor",FALSE
"1465618432053891080","1465618432053891080","Barbados becomes a republic and parts ways with the Queen ",FALSE
"1465618405269016579","1465618405269016579","Barbados says goodbye to Queen Elizabeth II, transforms into a republic - USA TODAY ",FALSE
"1465618657883553795","1465618657883553795","Barbados says goodbye to Queen Elizabeth II, transforms into a republic - USA TODAY ",FALSE
"1465618496176283650","1465618496176283650","Barcelona fire kills family of 4, including 2 children #news #topstories #berkleybearnews",FALSE
"1465599980521934855","1465599980521934855","Be happy for this moment. This moment is your life.” – Omar KhayyamONECHEERFUL YEAR WITH ANDI",FALSE
"1465599839140401152","1465599839140401152","Be happy it happened",FALSE
"1465598725061951488","1465598725061951488","Be happy with what you have. Be excited about what you want.ONECHEERFUL YEAR WITH ANDI",FALSE
"1465599731732733953","1465599731732733953","Be true. Be wild. Be happy.ONECHEERFUL YEAR WITH ANDI",FALSE
"1465599024484925444","1465599024484925444","Because of what I did, I have no choice to leave this earth and disappear. Be happy because you'll never ever going to see me again. Farewell to all of you.",FALSE
"1465599559287984132","1465599559287984132","Because you are the gift for the- especially my- World.Happy Birthday Kaeya Alberich!!#GenshinImpact #Kaeya  #<U+30AC><U+30A4><U+30A2> #<U+30AC><U+30A4><U+30A2><U+751F><U+8A95><U+796D>2021 ",FALSE
"1465599990156312579","1465599990156312579","Become happy <U+0001F97A><U+0001F97A> ",FALSE
"1465599480107913218","1465599480107913218","Being happy never goes out of style.ONECHEERFUL YEAR WITH ANDI",FALSE
"1465625836157956099","1465625836157956099","Benzema's highest NPG+A p90 ratio itl-15/16- 1.4221/22- 1.34*12/13- 1.1711/12-  1.1614/15- 1.0320/21- 0.96All-timer season hopefully ",FALSE
"1465598802090467330","1465598802090467330","Best Way to Stay Happy is to be busy.",FALSE
"1465633627492990979","1465633627492990979","Beyonce &gt;&gt;&gt; 'Fleet' Ratio",FALSE
"1465618346347479040","1465618346347479040","Bid to end housing crisis will see property owners paid to rent to the homeless - Wales Online ",FALSE
"1465618383005794304","1465618383005794304","Biden Administration could reinstate Remain in Mexico policy in days to come ",FALSE
"1465618264801923076","1465618264801923076","Biden vaccine rule for health workers blocked in 10 states ",FALSE
"1465618353624698881","1465618353624698881","Big non-league news which broke last night...have new owners - and they have moved quickly to bolster the playing squad ",FALSE
"1465618543605600258","1465618543605600258","Big shout to Diarmaid Mangan and his inclusion in the “NextGenXV” Schools Team of the Year <U+0001F3C1>_Official ",FALSE
"1465592550149201921","1465592550149201921","Binance Futures BTCUSDTPrice:$56,580Basis:0.06%OI:$3.4BOV:60.9kTaker Buy:66%Top Trader Pos Long:53%Top Trader Acc Long:79%Global Acc Long:78%Top / Global Ratio:+2.2469FR:0.01%(11/30 16:00 UTC)Insurance:$252.7M ",FALSE
"1465622748827643905","1465622748827643905","Binance Futures BTCUSDTPrice:$56,612.6Basis:0.02%OI:$3.3BOV:59.5kTaker Buy:61%Top Trader Pos Long:52%Top Trader Acc Long:80%Global Acc Long:80%Top / Global Ratio:+1.4949FR:0.01%(11/30 16:00 UTC)Insurance:$252.7M ",FALSE
"1465607652575440897","1465607652575440897","Binance Futures BTCUSDTPrice:$56,894.8Basis:0.02%OI:$3.4BOV:59.6kTaker Buy:33%Top Trader Pos Long:53%Top Trader Acc Long:80%Global Acc Long:79%Top / Global Ratio:+2.3004FR:0.01%(11/30 16:00 UTC)Insurance:$252.7M ",FALSE
"1465637852524744704","1465637852524744704","Binance Futures BTCUSDTPrice:$57,067.4Basis:0.04%OI:$3.3BOV:59.4kTaker Buy:59%Top Trader Pos Long:52%Top Trader Acc Long:80%Global Acc Long:80%Top / Global Ratio:+1.0935FR:0.01%(11/30 16:00 UTC)Insurance:$252.7M ",FALSE
"1465652948026150915","1465652948026150915","Binance Futures BTCUSDTPrice:$57,958.5Basis:0.1%OI:$3.4BOV:59.5kTaker Buy:55%Top Trader Pos Long:52%Top Trader Acc Long:80%Global Acc Long:79%Top / Global Ratio:+0.4273FR:0.01%(11/30 16:00 UTC)Insurance:$252.7M ",FALSE
"1465651852406579214","1465651852406579214","Binance Trade BotThe bot is built in Python, automatically jumps from one coin to another, increasing coin value (ratio) over time.Basic Linux+VPS skills required for installationGuide: #SHIB $BTC $FTM $KDA $STX $ETH $LUNA $DOGE $WAVES $QTUM ",FALSE
"1465618600505614349","1465618600505614349","Black man in WW2 Polish resistance<U+0001F642> ",FALSE
"1465618403566051329","1465618403566051329","Blast Rocks Afghan Capital Kabul, No Casualties Confirmed ",FALSE
"1465618719581917185","1465618719581917185","Blessing in disguise: Omicron variant may be ‘very positive’ news for the world if new Covid mutation kills off more lethal Delta coronavirus#OmicronVariant #covidvariant ",FALSE
"1465592349283737602","1465592349283737602","Block 711926Hash: 0x...043a92e24d5580e6c46fcd6df3df9078ef3968932759efSize: 1.48MB, 3992916 WU, 100% fullTxs: 3,175SegWit spends: 80%6,900 in <U+2192> 8,433 outOut/In Ratio: 1.22Out Value: $872,072,162 | 15,176 btc ",FALSE
"1465597638972256256","1465597638972256256","Block 711927Hash: 0x...0334115a3f7b9d3fcaef645c50b5e2d5966c4900455705Size: 1.42MB, 3999486 WU, 100% fullTxs: 2,889SegWit spends: 76%6,015 in <U+2192> 11,280 outOut/In Ratio: 1.88Out Value: $952,816,844 | 16,585 btc ",FALSE
"1465597870476828673","1465597870476828673","Block 711928Hash: 0x...0bdaee14cc551946f0902126f4fddc9ca180c31b065f82Size: 0.87MB, 2241843 WU, 56% fullTxs: 1,197SegWit spends: 87%4,155 in <U+2192> 3,755 outOut/In Ratio: 0.90Out Value: $78,594,549 | 1,368 btc ",FALSE
"1465597917679570950","1465597917679570950","Block 711929Hash: 0x...009dbe7507be578f122d7391b1755cfb4daf9a1563b8ebSize: 0.07MB, 193051 WU, 5% fullTxs: 121SegWit spends: 80%304 in <U+2192> 440 outOut/In Ratio: 1.45Out Value: $9,847,504 | 171 btc ",FALSE
"1465600003792113670","1465600003792113670","Block 711930Hash: 0x...04966529b45cd6f09f9634d53fc586e1e7e81284a86813Size: 1.11MB, 2993973 WU, 75% fullTxs: 1,659SegWit spends: 77%4,898 in <U+2192> 6,943 outOut/In Ratio: 1.42Out Value: $4,550,010,179 | 79,206 btc ",FALSE
"1465600466558013440","1465600466558013440","Block 711931Hash: 0x...0183642d89bac21de49558c349ddd906e7efb1bac79709Size: 0.17MB, 487133 WU, 12% fullTxs: 348SegWit spends: 78%853 in <U+2192> 914 outOut/In Ratio: 1.07Out Value: $86,873,505 | 1,512 btc ",FALSE
"1465606890562461698","1465606890562461698","Block 711932Hash: 0x...0c928c9fa060f431b1a4066a39433a6a86dca97821ba64Size: 1.65MB, 3993267 WU, 100% fullTxs: 1,554SegWit spends: 73%8,057 in <U+2192> 4,902 outOut/In Ratio: 0.61Out Value: $6,539,613,622 | 113,860 btc ",FALSE
"1465608184408813571","1465608184408813571","Block 711933Hash: 0x...0ba4a3dfb65948b8acb1da6034b244b7559a30a054a4d0Size: 1.71MB, 3992831 WU, 100% fullTxs: 1,174SegWit spends: 77%9,164 in <U+2192> 3,353 outOut/In Ratio: 0.37Out Value: $228,353,229 | 3,976 btc ",FALSE
"1465608246941696004","1465608246941696004","Block 711934Hash: 0x...036fe305eda14654e0ca52251414ff53d832487d819e1eSize: 1.66MB, 3992440 WU, 100% fullTxs: 2,738SegWit spends: 84%7,638 in <U+2192> 6,690 outOut/In Ratio: 0.88Out Value: $146,920,112 | 2,558 btc ",FALSE
"1465613489402171394","1465613489402171394","Block 711935Hash: 0x...0156d5b83adfbd8db5053f5a15cb8e6084e42a6b982193Size: 1.49MB, 3992636 WU, 100% fullTxs: 2,996SegWit spends: 78%6,613 in <U+2192> 10,163 outOut/In Ratio: 1.54Out Value: $5,142,596,443 | 89,554 btc ",FALSE
"1465613962700115969","1465613962700115969","Block 711936Hash: 0x...053587dc846cb3fdfa4f496cb31f66e1fc967f50381109Size: 1.75MB, 3992627 WU, 100% fullTxs: 1,806SegWit spends: 85%6,730 in <U+2192> 4,011 outOut/In Ratio: 0.60Out Value: $1,413,707,916 | 24,619 btc ",FALSE
"1465617323490955264","1465617323490955264","Block 711937Hash: 0x...04a6f4e5ebe2c77363955fa394144d726638eac7eac6adSize: 1.59MB, 3992640 WU, 100% fullTxs: 2,795SegWit spends: 80%7,155 in <U+2192> 7,292 outOut/In Ratio: 1.02Out Value: $3,160,865,603 | 55,052 btc ",FALSE
"1465621403613413377","1465621403613413377","Block 711938Hash: 0x...0153d7e3029401f0ec8e2fa70e91e749e07aa624aeb9baSize: 1.49MB, 3999414 WU, 100% fullTxs: 3,241SegWit spends: 81%6,799 in <U+2192> 8,922 outOut/In Ratio: 1.31Out Value: $2,525,996,199 | 43,997 btc ",FALSE
"1465623089807564805","1465623089807564805","Block 711939Hash: 0x...060b7658f1252b54096db9f0ca26da990159327f2f2526Size: 1.59MB, 3992978 WU, 100% fullTxs: 1,887SegWit spends: 81%7,138 in <U+2192> 5,568 outOut/In Ratio: 0.78Out Value: $282,250,055 | 4,916 btc ",FALSE
"1465626162235850759","1465626162235850759","Block 711940Hash: 0x...04d626b500bd0ee8a18b2cdc6a2c426e17a2e8b4d93d6aSize: 1.56MB, 3992408 WU, 100% fullTxs: 2,771SegWit spends: 81%7,495 in <U+2192> 6,831 outOut/In Ratio: 0.91Out Value: $2,005,247,792 | 34,928 btc ",FALSE
"1465634082059128833","1465634082059128833","Block 711941Hash: 0x...076553d391b761e05fa1e6a02f15c52f3be6a5dcc36fe3Size: 1.41MB, 3992849 WU, 100% fullTxs: 3,176SegWit spends: 78%6,507 in <U+2192> 9,828 outOut/In Ratio: 1.51Out Value: $6,851,750,062 | 119,363 btc ",FALSE
"1465637370804543488","1465637370804543488","Block 711942Hash: 0x...0b38e517826435236c5df2a825c6bc81d2afb1cec42123Size: 1.53MB, 3992418 WU, 100% fullTxs: 3,451SegWit spends: 83%6,771 in <U+2192> 10,233 outOut/In Ratio: 1.51Out Value: $2,560,775,506 | 44,611 btc ",FALSE
"1465639762027597830","1465639762027597830","Block 711943Hash: 0x...0364073af770578d7c49fcb09c15c2b661687aa88dd06dSize: 1.58MB, 3992836 WU, 100% fullTxs: 3,765SegWit spends: 85%7,284 in <U+2192> 8,812 outOut/In Ratio: 1.21Out Value: $1,792,605,359 | 31,230 btc ",FALSE
"1465643208424239112","1465643208424239112","Block 711944Hash: 0x...04508248083b0525f46f6961f43730e133f8fe57f59f87Size: 1.55MB, 3998160 WU, 100% fullTxs: 3,119SegWit spends: 81%7,031 in <U+2192> 8,410 outOut/In Ratio: 1.20Out Value: $2,149,396,046 | 37,446 btc ",FALSE
"1465646560138649608","1465646560138649608","Block 711945Hash: 0x...083e08ea030e0a6bd52550300d6fa82d8e09a8f1878054Size: 1.58MB, 3999217 WU, 100% fullTxs: 2,899SegWit spends: 81%7,247 in <U+2192> 8,893 outOut/In Ratio: 1.23Out Value: $829,836,155 | 14,457 btc ",FALSE
"1465646847687544832","1465646847687544832","Block 711946Hash: 0x...01da4ae057fa59f45cf1351e7cb8ffe588e668a70c55f0Size: 1.13MB, 2595821 WU, 65% fullTxs: 1,483SegWit spends: 85%5,484 in <U+2192> 3,441 outOut/In Ratio: 0.63Out Value: $1,480,117,955 | 25,785 btc ",FALSE
"1465650577686343685","1465650577686343685","Block 711947Hash: 0x...04c65f157c0e7fdb39de43569df45f4663d0ee71885904Size: 1.47MB, 3894944 WU, 97% fullTxs: 3,334SegWit spends: 81%6,588 in <U+2192> 8,838 outOut/In Ratio: 1.34Out Value: $1,938,838,382 | 33,774 btc ",FALSE
"1465652443769888770","1465652443769888770","Block 711948Hash: 0x...061f2fa75c59b8fe3d03d4b1d41b5d39f640dafe8fc60aSize: 1.11MB, 2768613 WU, 69% fullTxs: 1,836SegWit spends: 82%4,925 in <U+2192> 4,985 outOut/In Ratio: 1.01Out Value: $3,133,142,950 | 54,575 btc ",FALSE
"1465618492435009540","1465618492435009540","Booster vaccination rollout ramps up against new Covid variant ",FALSE
"1464614800617459712","1464614800617459712","Brace yourself <U+0001F32A>is coming in 3 days!!<U+23F0>WidiLand IDO time: 4AM, November 30 (UTC) <U+0001F449> Sign up to join WidiLand  IDO Community round at: <U+0001F449>Join Community Pool: <U+0001F449>Join Guaranteed Pool: ",FALSE
"1465618410121965573","1465618410121965573","Breaking News: $PTPI Casino Stocks: The Macau Arrest News That Has MGM, WYNN, LVS and MLCO on Red Today     #MWN #Stocks _swathi  $RLFTF $TOBAF $MRNA  via ",FALSE
"1465618508453138436","1465618508453138436","Breaking news Hong has received the ballon dor <U+0001F525>",FALSE
"1465618559325937673","1465618559325937673","Breaking news ",FALSE
"1465618524391493633","1465618524391493633","British tanks will return to Germany to keep growing Russian threat at bay ",FALSE
"1465599637746823171","1465599637746823171","But even though , I’m happy to new beginnings , I still think about him everyday .",FALSE
"1465634374611779584","1465634374611779584","But his calculus when it came to understanding the risk-to-benefit ratio of Covid vaccination was off. If infected, someone who is unvaccinated is 32 times more likely to die of Covid than someone who has been vaccinated.  <U+0001F97A>  ",FALSE
"1465598866548424710","1465598866548424710","But imagine how happy I’d be if  _Leclerc found out about my tattoo <U+0001F481><U+0001F3FC><U+200D><U+2640><U+FE0F><U+0001F970> ",FALSE
"1465617903684886528","1465617903684886528","CDC: Everyone 18 and older should get their COVID-19 booster shot. ",FALSE
"1465182285171331072","1465182285171331072","CENSWORLD - AIRDROP CAMPAIGN<U+0001F389>Airdrop: CENSWORLD<U+0001F3C6>Value: 200 $CENS<U+26A1><U+FE0F>Referral: Top 300<U+0001F525>Join Airdrop: ",FALSE
"1465618462617780229","1465618462617780229","CITN applauds Fed Govt, tax authorities on fiscal policy decisions | The Guardian Nigeria News - Nigeria and World News ",FALSE
"1464644529101975558","1464644529101975558","COVID UPDATE: Face coverings will become compulsory on public transport and in shops. Not including hospitality. ",FALSE
"1465618497241681921","1465618497241681921","COVID-19 vaccinations to be offered at Eastwood Mall this week ",FALSE
