"id","created_at","texte","suicide"
"1465618637038002176","1465618637038002176","Pooja Hegde’s latest read has left her heart-broken : Bollywood News ",FALSE
"1465618341356314628","1465618341356314628","Post Edited: Dunk of the Night: Isaac Okoro ",FALSE
"1465618211018313728","1465618211018313728","Post Edited: Game Recap: 76ers 101, Magic 96 ",FALSE
"1465618583329853441","1465618583329853441","Post Edited: Game Recap: Bulls 133, Hornets 119 ",FALSE
"1465618480632410115","1465618480632410115","Post Edited: Game Recap: Spurs 116, Wizards 99 ",FALSE
"1465599696731258882","1465599696731258882","Ppl get tired of seeing u happy <U+0001F603> whn they miserable <U+0001F616>",FALSE
"1465459113840758790","1465459113840758790","Praying for nothing else than the guidance of lord in everything I do and every path I take... +1 alhamdulillah.<U+0001F389><U+0001F973>",FALSE
"1465511079232954368","1465511079232954368","Prepare to be obsessed with 's performance on #TheVoice. <U+0001F60D><U+0001F3B8> ",FALSE
"1465618430472568833","1465618430472568833","President Biden: Omicron coronavirus variant 'a cause for concern, not a cause for panic'-",FALSE
"1465510624671277063","1465510624671277063","Pride of Nationhood: Declaration of the Republic and Installation of the President of Barbados ",FALSE
"1465546352167989249","1465546352167989249","Protect yourself by protecting your data.Happy International Computer Security Day.#ITAdOn, #ITsupport, #philadelphia, #smallbusinesses #tristate #informationsecurity ",FALSE
"1465618230924521473","1465618230924521473","Pub guests got trapped for 3 days and liked it — RT UK News ",FALSE
"1465604762376671233","1465604762376671233","Pura life yahi suna ki the day India achieves equality in gender ratio it will be developed. Now when we have achieved it or rather surpassed it, why aren’t we celebrating the way it has to be. The noise is missing, is it coz it happened during Modi Rule not some non-BJP rule?",FALSE
"1465589590270566401","1465589590270566401","Purchasing power of GDHI by consumption unit was stable in Q3 2021 (0.0%), while corporations’ profit ratio fell…",FALSE
"1465206746197151754","1465206746197151754","Pussy is extremely easy to get. It’s when you want more from women like intelligence, honesty, consistency, it gets a little challenging.",FALSE
"1465598828015497223","1465598828015497223","Put this on your profile            and who feels happy                      to be your mutual                                will comment(Early morning ckebwb)",FALSE
"1458607203313672196","1458607203313672196","Quand je vous dis que j’étais subjugué. Burna pour me tueeeeeeeer <U+0001F90D><U+0001F90D> ",FALSE
"1465618637587374084","1465618637587374084","Quarter of Johnson Cabinet took Russia-linked cash as Tories head to Conference surely a resigning matter for each of them -",FALSE
"1463222686113488912","1463222686113488912","Questions for stan Twitter users to answer when you’re bored! (priv qrts are fine, feel free to skip questions)",FALSE
"1465599193850863626","1465599193850863626","Quick Update on the Legitimacy of Commercial Space for launching on December 8, 2021Mayors Permit - DoneBIR Forms and Permits - DoneWorking Permit of Therapist - DoneShet yung gown ko, hindi pa nagagawa! Charought <U+0001F605>Happy Holiday ses! <U+0001F60A>",FALSE
"1465626699635183618","1465626699635183618","RATIO",FALSE
"1465589650580410372","1465589650580410372","RATIO DAW <U+0001F62D><U+0001F62D><U+0001F62D>",FALSE
"1465616147697778692","1465616147697778692","RIKU826[PZIV] killed in the training room by our deputy clan lead whose win ratio is 27%. Now you can see how bad GuP clans are.",FALSE
"1465604908716077058","1465604908716077058","RIP John SillettCoventry City Football Club are devastated to learn of the death of Sky Blues icon John Sillett at the age of 85.#PUSB ",FALSE
"1465591898039533573","1465591898039533573","RT _News: Purchasing power of GDHI by consumption unit was stable in Q3 2021 (0.0%), while corporations’ profit ratio fell…",FALSE
"1465591566089822209","1465591566089822209","RT : The key demographic transitions captured by the 5th round of National Family &amp; Health Survey show that India's sex ratio has improved to 1020 girls for every 1000 boys. Additionally most health indicators are also up.#BharatKiBeti  ",FALSE
"1465598775041400834","1465598775041400834","Rachael Ostovich is happy BKFC exists after nearly going broke in MMA<U+0001F447> ",FALSE
"1465642282506354689","1465642282506354689","Radio Receiver Signal to Noise Ratio SNR Specification ",FALSE
"1465642353641902082","1465642353641902082","Radio Receiver Signal to Noise Ratio SNR Specification #hamradio",FALSE
"1465651167078371336","1465651167078371336","Radio Receiver Signal to Noise Ratio SNR Specification ",FALSE
"1465600227067498499","1465600227067498499","Ran Up 23 Thousand Before The Deal Thank God I Got To See 23 Happy Bday Too Me <U+2665><U+FE0F>",FALSE
"1465618229825523720","1465618229825523720","Rand Paul blasts Fauci: 'Astounding and alarming' to declare 'I represent science' via ",FALSE
"1465590716923629571","1465590716923629571","Ratio",FALSE
"1465620470682824706","1465620470682824706","Ratio + Pogba owns your cm",FALSE
"1465633186063347715","1465633186063347715","Ratio by preety joon ",FALSE
"1465648850845249536","1465648850845249536","Ratio check <U+2696><U+FE0F> ? <U+0001F975>",FALSE
"1465594671309017088","1465594671309017088","Ratio for asking Lord <U+0001F60C> ",FALSE
"1465646093862064136","1465646093862064136","Ratio ",FALSE
"1465606907616444418","1465606907616444418","Ratio ",FALSE
"1465633823186690048","1465633823186690048","Ratio ",FALSE
"1465621103448055812","1465621103448055812","Ratio ",FALSE
"1465634163768193026","1465634163768193026","Ratio me I dare you",FALSE
"1465603550508105734","1465603550508105734","Ratio me.",FALSE
"1465592768219148296","1465592768219148296","Ratio so cold, Greninja's legs froze ",FALSE
"1465653317061726214","1465653317061726214","Ratio then",FALSE
"1465618282719989762","1465618282719989762","Really hope Tice splits the Tory vote to allow any other than a Tory MP to be elected  ",FALSE
"1465637097864368135","1465637097864368135","Really useful these boxes for storing all the experiments. They stack well and the different sizes mean that they are more efficient in the storage/space ratio. Makes easy to find as we work on an experiment on demand system. ",FALSE
"1465618406628077569","1465618406628077569","Recent news from BMW has made me want an E34 estate more than ever before.",FALSE
"1459711686936571904","1459711686936571904","Registration is now open for the 2022 Annual Conference, taking place at the Arizona Biltmore in Phoenix from Feb. 22-24. #fluidpower",FALSE
"1465600388783296513","1465600388783296513","Relaxing your day by this music for FREE, check this video and SUBSCRIBE for more!! #relaxing #music #meditation #soul #sleepmusic #sleep #calmmusic #calm #viral #share #retweet #fun #style #love #beautiful #happy #like4like #followme #art #repost #nature",FALSE
"1465600359603359747","1465600359603359747","Releasing an album with members made me so happy. (...) Just the fact that i was with my members made me happy"" - #KAI <U+0001F62D><U+0001F62D><U+0001F62D> ",FALSE
"1465646641600503808","1465646641600503808","Reminder that Super Vegeta has:&gt; 400% Atk and def&gt; Best defensive ability for esbr (guaranteed stun)&gt; Best offensive ability in the game (guaranteed crits)&gt; Leads what is probably the best team in the game&gt; And when being slot 1 he is #1 on the apt charts for Turs ",FALSE
"1465598471000449029","1465598471000449029","Removing dislikes is a dirty commie dem ploy. The filthy liberal media (YouTube) doesn’t want you to know that the like to dislike ratio on “Liberals Getting Publicly Owned Compilation” is 36% higher than the latest CNN upload.",FALSE
"1465534604702588928","1465534604702588928","Reply to get ratioed",FALSE
"1465618416321105928","1465618416321105928","Retired cop working security for news crew mortally wounded in struggle for camera #Camera #security via ",FALSE
"1465600337084096512","1465600337084096512","Ringside Report Wishes Our Webmaster &amp; Graphics Guru Mel Walker a Happy 58th Birthday ",FALSE
"1465588438367834115","1465588438367834115","Rise in govt school enrolment impacts teacher-student ratio in Rajasthan via ",FALSE
"1465618495454924803","1465618495454924803","Robert Carnell (1965 - 2009), died at age 44 years: In Memory of Robert Carnell. Personal Death record and Detailed information about the deceased person. #people #news #funeral #cemetery ",FALSE
"1465618504300646403","1465618504300646403","Robert Green (1931 - 1982), died at age 51 years: In Memory of Robert Green. Personal Death record and Detailed information about the deceased person. #people #news #funeral #cemetery ",FALSE
"1465517515195314183","1465517515195314183","Rock sol  meme token and 3D nft #Airdrop first 20k user Token supply 75000000Join Discord Fill form: -Follow us-Reply your Sol address  -Tag 3 Friends Every valid entry will get 40000 #Rock token$SOL #Airdrop #Rocksolana9",FALSE
"1462411106773831698","1462411106773831698","Russia wants to equate mining with entrepreneurshipAt the moment, in Russia, there are no clear rules for the regulation of mining. As a result, the government wants to correlate such activities with entrepreneurship and tax them according to the same system.#Mining #Amphorium ",FALSE
"1465618721762951169","1465618721762951169","SABC head of news Phathiswa Magopeni has lodged a formal complaint against the public broadcaster's CEO Madoda Mxakwe for several issues, including alleged editorial interference, abuse of power and attempts to remove her from her position. ",FALSE
"1465618409509502978","1465618409509502978","SARA invites proposals for collaborative working groups to pursue inter- or transdisciplinary research that synthesizes understanding under the guiding theme of “Building equitable resilience in southern Africa”. ",FALSE
"1465651907037470732","1465651907037470732","SEER nedir (Seasonal Energy Efficency Ratio)? nedir? ",FALSE
"1465604401930719232","1465604401930719232","SHIMANO Aldebaran MGL Baitcasting Fishing Reel, Gear Ratio: 6.5:1, RH (ALDMGL50) eBay ",FALSE
"1465644930651631618","1465644930651631618","SHOULDER TO WAIST RATIO",FALSE
"1465618212511535113","1465618212511535113","SN277 - Incident: Brussels A333 at Brussels on Nov 29th 2021, captain incapacitated #flight #incident #BrusselsAirlines #SN277 #ACC #LFW",FALSE
"1465653033761607681","1465653033761607681","SOPE LIVE !",FALSE
"1465614811476201472","1465614811476201472","SOUTH AFRICA 2030 BOND BID-TO-COVER RATIO AT 3.6, 2037 BOND BID-TO-COVER RATIO AT 2.0,  2040 BOND BID-TO-COVER RATIO AT 2.0 #News #Forex #BOND",FALSE
"1465618627349016577","1465618627349016577","SPORTS - Sky News:  Andre Gray's 90th-minute wondergoal! ",FALSE
"1465618552107405318","1465618552107405318","STAY TUNED! SOMETHING IS COMING TOMORROW! Exciting news will be dropped TOMORROW! So, don't forget to stand by and check it out! See you tomorrow!! #Exciting #rtolerantia #tolerantiareach #News #Tomorrow ",FALSE
"1465599942584455169","1465599942584455169","STOLEN<U+2727>                                                      <U+2727>            Put this on your profile            and who feels happy               to be your mutual                    will reply<U+2727>                                                       <U+2727>",FALSE
"1465648997368881157","1465648997368881157","STOP DEACTIVATING think about my ratio",FALSE
"1464176273383514113","1464176273383514113","SURPRISE CASH || 8 HR— rt and follow <U+0001F514>",FALSE
"1465599005661233152","1465599005661233152","Same energy.Not sure if I have to be happy or adamant",FALSE
"1465593666219626496","1465593666219626496","Same issue with Poodles, that Elves of the North will face. It's gonna brick hard. Holder distribution ratio is wayy off. This is degen level 9/10 right now ",FALSE
"1465599689718382592","1465599689718382592","Samidoh's wife Edday shared a video jamming to Lava Lava's Niko Single song, and she looked happy.Reacting to her video, a fan said: ""Uzuri wa TikTok unaweza kuwa single ukitaka.""Another one wrote: ""Samidoh alienda USA ukakuwa single.""#tukonews ",FALSE
"1465595627912507397","1465595627912507397","Sara Jay a bad bitch fr",FALSE
"39734","39734","Sat next to a transvestite who immediately ordered a vodka lemonade. Interesting 5 hours.",FALSE
"1465618635884486660","1465618635884486660","Saudi Crown Prince Bin Salman once again tricks with Pakistani rulers, ,,",FALSE
"1465597901640548358","1465597901640548358","Saw an old friend from high school on insta and noticed that he looks substantially hotter, went to check out his Twitter and c he’s already following my main. Mans has a skinny ratio and I think I’m the only person from hs he follows.  Some1 humble me rn.",FALSE
"1465652029045370888","1465652029045370888","Saying ""ratio bozo"" is fuckin cringe stop no one gives a fuck but you're mom did last night...",FALSE
"1403219571880910853","1403219571880910853","Sbwl to recreate this any volunteers? <U+0001F923><U+0001F923><U+0001F923><U+0001F60D><U+0001F60D> ",FALSE
"1465599735994232836","1465599735994232836","Seeing so many black people in one place and its for enjoyment honestly made me soooo happy.",FALSE
"1465596566526468099","1465596566526468099","Seungmin [30.11.21] 5:15 pmaccept my kiss ",FALSE
"1465618478501482500","1465618478501482500","Shashi Tharoor shares pic with women MPs, says Lok Sabha attractive place to work. Internet blasts him - Trending News News ",FALSE
"1465600322160807945","1465600322160807945","She placed her paws on her cheeks she seeemed really happy “heha I’m everyone’s puppy but only azzys “ she smiles blushing SHE HAPP DOGGO",FALSE
"1465595105625182209","1465595105625182209","She was begging for a ratio the whole day <U+0001F62D> essays after essays being shady to bt5 how can someone be so pathetic <U+0001F62D><U+0001F62D>",FALSE
"1465600184474292227","1465600184474292227","She was so happy here ",FALSE
"1465618653957836801","1465618653957836801","Shelbourne to enter Champions League in first round as UEFA confirm seedings #tips #tipster #bets #freetips #sportsbetting #betting #inplay #news #times link &amp; Copyright for syndicated content belongs to the source link From url Source ",FALSE
"1465618246586056706","1465618246586056706","Shop workers shouldn’t feel unsafe in their place of work, just #WearAMask ! I’ve never stopped wearing one, it’s really not a big deal <U+0001F937><U+200D><U+2640><U+FE0F> ",FALSE
"1465596705605238794","1465596705605238794","Shorted when nifty came to my level of 17300-400 as given in the morning postAnd squared off at 17000-50 in tranchesNow won't short again if nifty shows any strength today and comes near this levelThe risk to reward ratio might not be good enoughWaiting is better sometimes",FALSE
"2113343038","2113343038","Shout out to me  (#TilaTequilaLive live &gt; http://ustre.am/3mHL)",FALSE
"1465642836528099329","1465642836528099329","Sica has the Golden Hip Ratio 7:10 (her waist is 21 inches and her hips are 30, when you divide waist by hips it equals 0.7, the golden hip ratio",FALSE
"1465622129651691526","1465622129651691526","Signal to noise ratio is a key radio receiver specification -find out more about it in this video.#signaltonoise #Radio #hamradio #hamr #amateurradio",FALSE
"1465651537804288007","1465651537804288007","Similar to the nonsynonymous/synonymous substitution rate ratio for coding sequences, selection on non-coding sequences can be quantified as non-coding nucleotide substitution rate normalized by synonymous substitution rate of adjacent coding sequences.",FALSE
"1465600323666341891","1465600323666341891","Simple birthday celebration of my elder brother and his daughter.HAPPY BIRTHDAY to both of you Manu Boy &amp; Tata<U+0001F382><U+0001F382><U+0001F382> ",FALSE
"1465599213996503040","1465599213996503040","Simple gestures that make my heart genuinely happy :&gt;",FALSE
"1465599077832216578","1465599077832216578","Since yesterday i am watching #TwitterCEO story &amp; #India is proud kind of comments. But personally i am not happy to see him hired by #Twitter. They hired our best minds at any cost since long , but we need them in India. When we should expect inter change . ? #ParagAgarwal",FALSE
"1465404118420402186","1465404118420402186","Sing la di da",FALSE
"1465599602657214464","1465599602657214464","Six scientists. Six suicides. What secret are they dying to protect? #goodread #happy Learn a secret to long life!",FALSE
"1465647782992433153","1465647782992433153","Size=30:32:34:36:38Ratio=1:2:2:1:1Moq=56pcs Hyper flex denims 2 styles torn 2 styles bottom unfinished 4 styles superb washing done Best fit guarantyMust buy @ Mitee Mens Boutique ",FALSE
"1465620374670888968","1465620374670888968","Small food Trailer<U+0001F354> ice cream Trailer <U+0001F366>milk tea Trailer<U+0001F964><U+0001F525>A very good dessert Trailer with small shape and many colors. It has the attribute of ""network celebrity"". The key is that the input-output ratio is super high.<U+0001F389>#foodtrailer #icecreamtrailer",FALSE
"1464924760635101187","1464924760635101187","So didn't tweet about Rosé's nominations on MMA and Gaon Chart Music Awards, why is that?",FALSE
"1465576073085685761","1465576073085685761","So I'm gonna nap and we will see if my alarm wakes me up <U+0001F9CD><U+200D><U+2640><U+FE0F>",FALSE
"1465625550941265920","1465625550941265920","So bullish on $DAG its unreal fellahs.Will be the best play in satoshi ratio for 2022. Keep that in mind.Everything will purge and is going to drop the biggest tech improvement blockchain has seen since #Ethereum launched.$50 is programmed.",FALSE
"1465599448772317186","1465599448772317186","So happy class got cancelled<U+0001F62D> making breakfast tomorrow 4 sure",FALSE
"1465599749835440134","1465599749835440134","So happy for you! _Zo Seeing you happy fills me with so much joy <U+0001F90D>",FALSE
"1465462589501186048","1465462589501186048","So wizkid didn’t bring our drake or Justin bieber and performed for 30mins ",FALSE
"1465618506519658499","1465618506519658499","Social News Base Thank you for following me!!",FALSE
"1465599201694425090","1465599201694425090","Solomon Ray’s snap story makes me so happy",FALSE
"1465599314512826374","1465599314512826374","Some Man United Players Are Not Happy With Rangnick’s Appointment (FULL STORY) ",FALSE
"1465618533820235778","1465618533820235778","Some big news from our <U+2066><U+2069> team today. You can read about our new case for <U+2066><U+2069> at the link.Second Supreme Court challenge to Woodside’s Scarborough development - Environmental Defenders Office ",FALSE
"1465618727613964294","1465618727613964294","Some people are pretty fucked up ",FALSE
"1465612701896364036","1465612701896364036","Someone thought my following ratio on insta was good and I quickly had to let them know it is only because I unfollow everybody when I have mental breakdowns. I am not at all cool, just unhinged.",FALSE
"1465599938339819520","1465599938339819520","Sometimes I gotta pretend I’m happy",FALSE
"1465600234550136838","1465600234550136838","Sometimes, the only reason why you won't let go of what's making you sad is because it was the only thing that made you happy.",FALSE
"1465618323639394304","1465618323639394304","Sony's Finally Got A Patent For Its PlayStation 5 Faceplate Design ",FALSE
"1465599230064488452","1465599230064488452","Sooo excited! My #TuesNews is that I've got my first Christmas card &amp; first Christmas present - from the gorgeous team ! Thank you for the amazing Christmas reads by &amp; Happy Christmas to you all! Luvs n hugs from Lily xx <U+0001F970><U+0001F4DA><U+0001F384> ",FALSE
"1465574170234961922","1465574170234961922","Source: Javier Báez is close to signing a multiyear deal with #Tigers. ",FALSE
"1465618619338010626","1465618619338010626","South East confidence on the rise - Lloyds ",FALSE
"1465618387116208134","1465618387116208134","Sr. Product Security Engineer ï¿½ IAM &amp; Crypto(Remote) CRYPTO CRYPTO NEWS - ",FALSE
"1465599431512891396","1465599431512891396","St Andrews Day, it has to be a Scottish themed post to wish a very <U+0001F389>Happy birthday<U+0001F389> to  on this your own very special day.  Thinking of you and hoping you are thoroughly spoiled by Himself. Sending all our love from the #Fricomedy crew xxx ",FALSE
"1465600307853811712","1465600307853811712","Stay fit, stay healthy, stay happy.  #HealthyPeopleHealthyNation",FALSE
"1465637450190106631","1465637450190106631","Stay out the shopping areas and stay strapped. Debt to pay ratio of avg American  is too high in the US right now - will see a lot of desperate actors these coming months.",FALSE
"1465631231345893380","1465631231345893380","Stays I'm stay too stopthe ratio <U+0001F62D>",FALSE
"1465519932918149124","1465519932918149124","Steve Cohen is ruining baseball.He’s overpaid a few players already which is screwing the market. Showing he doesn’t understand baseball. The Mets should be ashamed. Owners are not happy.",FALSE
"1465599652397559812","1465599652397559812","Still remains the greatest player of all time <U+0001F410><U+0001F44D><U+0001F3FE> ",FALSE
"1465599271814811656","1465599271814811656","Stolen<U+2727>                                                      <U+2727>            Put this on your profile            and who feels happy               to be your mutual                    will reply<U+2727>                                                      <U+2727>",FALSE
"1465609318649274373","1465609318649274373","Straight hair is aryan, curly hair and wavy hair is for Jews and brown ppl",FALSE
"1465448288656797700","1465448288656797700","Stream your favorite K-Pop artist now on Apple Music to vote for your #2021MAMA Icon of the Year.",FALSE
"1465598758796861441","1465598758796861441","Stress less: how you can let go of your worries. #Mindfulness for Beginners ep120, listen and share! :)#podcast  #podcasts #podnation #podernfamily #rtitbot #mentalhealth #RT #blogdreamRT #BBlogRT  _rt _RTsClick here &gt;&gt;&gt;",FALSE
"1465598838018752512","1465598838018752512","Success doesn't necessarily make you a happy persoSuccess doesn't necessarily make you a happy perso<U+0627><U+0646><U+0633><U+062E> ""NBF150""",FALSE
"1465598888069541891","1465598888069541891","Success is just being happy. And I try so many difTherefore be at peace with God, whatever you conce<U+0627><U+0646><U+0633><U+062E> ""NBF150""",FALSE
"1465618407382941701","1465618407382941701","Such a amazing news for everyone and congratulations tseries many more to come #TSeriesCrosses200MilSubs ",FALSE
"1465618432095920131","1465618432095920131","Such an amazing news for us that our T-Series has completed 200 millions of subscribers.... Congratulations...#TSeriesCrosses200MilSubs ",FALSE
"1465618451192557568","1465618451192557568","Supreme Court orders immediate release of MNA Ali Wazir - Mashriq News #AliWazir #SupremeCourt",FALSE
"1465609859781455872","1465609859781455872","Survey speaks A demographic shift, women ratio surpassed men for the first time in India 1,020: 1,000 according to findings of the NFHS-5.A significant rise from NFHS-4 (78.9 per cent) is a proof that India isachieving universal institutional births#betibachaobetipadhao ",FALSE
"1465618383819448322","1465618383819448322","Sustainable Scotland: TV's Simon Reeve says communication is key in the fight against climate change | The Scotsman",FALSE
"1465618389393682441","1465618389393682441","Sutton councillor faces calls to resign over SDEN scandal ",FALSE
"1465618509640056835","1465618509640056835","Swiss Plan to Reopen Border for Vaccinated Overseas Travelers - Bloomberg ",FALSE
"1465618482465484802","1465618482465484802","Syria hosts first international basketball tourney in years ",FALSE
"1465622955455438852","1465622955455438852","THE FEMININE URGE TO RATIO ALL MY FRIENDS",FALSE
"1465628973451210762","1465628973451210762","TOP 10 DEFI PROJECTS WITH THE LOWEST MARKET CAP / TVL RATIO$MOON $SWAMP $BANANA $WTON $BORING $BELT $WINGS $ACS $HYFI $RABBIT ",FALSE
"1465618632193495041","1465618632193495041","TOWNHALL reports: Fox News Contributor Zeroes In on Everything You Need to Know About the Omicron Variant.   ",FALSE
"1461223198796697601","1461223198796697601","TS VIPER RED HEAD BIMBOFICATION PLASTIC PANTYHOSE LATEX RUBBER STOCKING SMOKING 120 MM RUBBER GLOVES HIGH HEEL MISTRESS DOMINATION ",FALSE
"1465599590355410947","1465599590355410947","TULOY TULOY ANG SAYA MAMAYA SA PALARONG PANG FAMELLAS! Right after ng Gmeet we will proceed sa Games! Doon naman tayo sa Kumu! Handa na ba kayo?BRING ME (with a twist)JACKnPOY TAKE ALLFinding EmojisIkembot mo ang Sagot mo! Q&amp;A Team Leaders/Admins (Longest Tune) ",FALSE
"1465598980491038724","1465598980491038724","Take a look at Nadine Samonte's happy family life behind the camera in this photo gallery:",FALSE
"1465600044602912769","1465600044602912769","Take time to do what makes your soul happy.",FALSE
"1465618714699583494","1465618714699583494","Taliban Elite Special Forces Tasked With Night Raids On Former Security Force Members ",FALSE
"1465618721376985090","1465618721376985090","Taliban’s ‘war on drugs’ put into action — RT World News ",FALSE
"1465621626431619081","1465621626431619081","Tamil Nadu 4th lowest in poverty ratio, Puducherry lowest among UTs ",FALSE
"1465623032979165184","1465623032979165184","Tamil Nadu 4th lowest in poverty ratio, Puducherry lowest among UTs via ",FALSE
"1465600409733632000","1465600409733632000","Taunting me with their happy chirping… why I oughta <U+0001F60A> ",FALSE
"1465618362294157315","1465618362294157315","Tenable teams up IBM Security X-Force Red to identify and disrupt attack opportunities before bad actors can leverage them. ",FALSE
