"id","created_at","texte","suicide"
"1239220947879673858","Sun Mar 15 16:04:32 +0000 2020","FEAR in the virus.  How sad we minimize the veterans that commit suicide, 25 a day, the innocents killed by drunk drivers, the ones murdered, the countless aborted babies, the gun shot, knife victims, ......FEAR IS THE VIRUS.  Least we forget ALL LIVES MATTER",TRUE
"1282370835819438083","Sun Jul 12 17:46:47 +0000 2020","Findings from University College London reveal that 8,000 out of 44,000 people surveyed (18%) reported thoughts of self-harm or suicide, and 42% had accessed support services. A further 5% said they had harmed themselves at least once since the start of the UK’s lockdown.",TRUE
"1338375034797252608","Mon Dec 14 06:47:28 +0000 2020","First day of being in school again:I already want to commit mass suicide with the boys...",TRUE
"1338461850309021696","Mon Dec 14 12:32:27 +0000 2020","For a community that has always prided itself on accepting those who felt like outsiders/geeks and grew up getting bullied, the video game community is real quick to be mean to others in their own community.",TRUE
"1282744980835127304","Mon Jul 13 18:33:30 +0000 2020","For all of you out there struggling with depression,who have cried their eyes out to Allah for help &amp; relief,who have had thoughts of suicide. Relief is coming. I know what it feels like. To feel hopeless, unimportant &amp; humiliated.",TRUE
"1205341185348440064","Fri Dec 13 04:18:27 +0000 2019","For pass two weeks I have had to see my Psychotherapists everyday the holidays are never happy I work very hard to stay sane and to not have suicide thoughts.. #ForEverAkeal",TRUE
"1206231020451721216","Sun Dec 15 15:14:20 +0000 2019","Fuck LA lol it’s a dirty , gross place . The traffic makes you want to commit suicide . Only time I’m stepping foot down there is to see the Lakers play.",TRUE
"1337880482747277313","Sat Dec 12 22:02:18 +0000 2020","Funny how ya’ll resort to this conclusion on why ppl don’t like the movie. A hyuga getting bullied? Naruto doing that clone jutsu young age, or having a byakugan but getting caught in a spider web? The series was named Naruto but Sakura’s always the talk of the town ",TRUE
"1237087581872979970","Mon Mar 09 18:47:18 +0000 2020","Further down the hall, another student: “She always getting injured!!” I AM TIRED of getting bullied by these kids! <U+0001F602><U+0001F602>",TRUE
"1338988262522724352","Tue Dec 15 23:24:13 +0000 2020","GUYS OMG OKtw // suicideso you know how wilbur was always mentioning the chekhov’s gun thing WELL THE SAME IS HAPPENING TO TOMMY the amount of times tommy’s stood against the ledge but never jumped off, he keeps saying it’s almost the end for him but it hasn’t happened yet",TRUE
"1237109329376849921","Mon Mar 09 20:13:43 +0000 2020","Getting bullied and being told “you always look so happy tho”, is so bad cause you get so numb to it and shit hurts",TRUE
"1338171338855383040","Sun Dec 13 17:18:03 +0000 2020","Girls talk about how they are looked down upon in the apex community and how they are judged unfairly BUT if you really think about it, you should be worried about the people who have bad stats they literally get no space to breathe since they are always getting bullied.",TRUE
"1237346854288973829","Tue Mar 10 11:57:33 +0000 2020","Good morning, everyone. I don't know how much I'll be on today. Got some very bad news, we lost a strong, sweet resister. , Viv, to suicide.  I will post more once I clear it. RIP Viv. <U+0001F622><U+0001F494> Dance with the Angels.<U+0001F483><U+0001F483> ",TRUE
"1338938559814885377","Tue Dec 15 20:06:43 +0000 2020","Gun violence kills nearly 40,000 Americans each year &amp; 61% are suicides. Join Dr. Robert Kinscherff, professor of clinical psychology, &amp; for a Facebook Live discussion tomorrow 12/16 at 3pm exploring Data-Driven Solutions to Prevent Gun Suicide. ",TRUE
"1238564891692273664","Fri Mar 13 20:37:36 +0000 2020","Guyssss.... Help out. I don't want this guy to commit suicide. He's been able to raise his school fees and all... But things aren't still going well. I don't know what to do anymore <U+0001F629><U+0001F629> ",TRUE
"1282731194740858881","Mon Jul 13 17:38:43 +0000 2020","Had a loved one call the suicide hotline and when asked if they had thoughts of harming themselves, they did NOTHING. Have been searching for help and been turned away and given different information. The view on mental health is disgusting and needs change! ",TRUE
"1334773736906649600","Fri Dec 04 08:17:12 +0000 2020","Had a lovely round of crazy lady vibez <U+2728> earlier tonight and couldn’t unglue my ass from the couch. I’m pretty sure I’m slowly killing myself cause I can’t find my fucking voice. Now here I am after a two hour nappy nap revisiting the seven thousand thoughts that were running",TRUE
"1338277345359056897","Mon Dec 14 00:19:17 +0000 2020","Happy 31st birthday to the one person who's ALWAYS been there for me, if I was getting bullied, got heartbroken, felt insecure or not good enough she was always there, her songs have been there when I needed to feel heard. Thanks for being like a big sister Ily. ",TRUE
"1235993597654204417","Fri Mar 06 18:20:11 +0000 2020","Happy late Women's Day Cara Delevingne you are a great role model darling I love you honey &amp; I felt so grateful to have met you in the Suicide Squad &amp; the Valerian UK Premiere in Leicester Square, London too hopefully I will get to see you once more <U+2764><U+FE0F><U+2764><U+FE0F> ",TRUE
"1237074312802099200","Mon Mar 09 17:54:34 +0000 2020","Have you had any thoughts of torturing yourself?#suicide",TRUE
"1235340858846781441","Wed Mar 04 23:06:26 +0000 2020","He said more than once if he thought I was going to divorce him he'd just commit suicide",TRUE
"1283296529734762497","Wed Jul 15 07:05:09 +0000 2020","He was living his every dream one by one, was full of positive thoughts and had a good vision for indian education system. He was a #selfmusing<U+0001F4AB> person who needed no one to be happy. How can a man like him commit suicide! CBI enquiry is MUST.  ",TRUE
"1283276491615166464","Wed Jul 15 05:45:32 +0000 2020","He was living his every dream one by one, was full of positive thoughts and had a good vision for indian education system. He was a #selfmusing<U+0001F4AB> person who needed no one to be happy. How can a man like him commit suicide! CBI enquiry is MUST. #CBIForSonOfBihar ",TRUE
"1338958692520116224","Tue Dec 15 21:26:43 +0000 2020","He's always aware about mental health issues. He'd never make a joke about this topic. If these people were true fans of liam they'd know that. But no they had to set him up for getting bullied",TRUE
"1238916079910518787","Sat Mar 14 19:53:06 +0000 2020","Help me , I want to commit suicide",TRUE
"1237793433051422721","Wed Mar 11 17:32:06 +0000 2020","Here's my (more than annual reminder) that you can care about more than two things at once. You can care about #COVID19 deaths/pandemic and worry about the suicide rates, gun deaths, drunk driving deaths, cancer deaths, etc.",TRUE
"1235677601525571584","Thu Mar 05 21:24:32 +0000 2020","Here's my cover of a hymn by William Cowper. Cowper struggled with depression for most of his life and actually tried to commit suicide more than once. These powerful words reflect the struggle of his life, and our hope in God. #hope #GodIsGreat ",TRUE
"1338975033700433920","Tue Dec 15 22:31:39 +0000 2020","Here's one that isn't too shit in and of itself, but the supposed ""answers"" are.The puzzle asks you to look at this pic and determine if it's a murder, suicide, or accident. The most you can prove is the gun wasn't the murder weapon since there is no bullethole at the scene. ",TRUE
"1238211352906399745","Thu Mar 12 21:12:46 +0000 2020","Here's what we're NOT gonna do: we're not gonna downplay rational COVID-19 concerns with ""but suicide/heart disease/obesity/drones/etc kill even more ppl per year than coronavirus"" b/c:1. we already know, thanks for nothing2. We can care about 2+ things at once3. PANDEMIC ",TRUE
"1338556628795318280","Mon Dec 14 18:49:04 +0000 2020","Hi,im Taliyah and im 16 yrs old and i was born in Miami its always hot asfk here but that besides the point ive been getting bullied for the last 3 yrs by this nigga Jason he just dont got nun better ta do and he my bsf brother so its worst<U+0001F644>",TRUE
"1205167566492094469","Thu Dec 12 16:48:33 +0000 2019","Honestly, The Batman and The Suicide Squad actually sound pretty good. They could be total dumpster fires for all I know, but for once I'm more excited and eagerly anticipating what DC is going to do next. Marvel's been beating them since the start, but now there's an opening. ",TRUE
"1338728677534617602","Tue Dec 15 06:12:43 +0000 2020","How could buddha say SSR will commit suicide one day upon meeting him once only?One cannot predict suicide but can predict murder when he is a part of it himself....Still why no summons for him ??Are criminals more powerful than judiciary system?#CBIEndSilenceInSSRcase",TRUE
"1283153723158650880","Tue Jul 14 21:37:42 +0000 2020","How is this a speedy trial? Do they *want* someone to kill her—oops!—I mean, do they want her to commit suicide in the meantime? <U+0001F644> ",TRUE
"1283403980337537025","Wed Jul 15 14:12:08 +0000 2020","However, when I first heard that it's going to be a goofy interpretation in the style of your average coming-of-age wizard book series, I was disappointed. That is not what Scholomance is! Kel'Thuzad didn't commit career suicide for this! I didn't want it to be another Karazhan.",TRUE
"1238576386366935040","Fri Mar 13 21:23:16 +0000 2020","I WANT TO DIE...I WANT TO COMMIT SUICIDE..! <U+0001F62D><U+0001F62D><U+0001F62D><U+0001F62D><U+0001F62D><U+0001F62D><U+0001F62D>BY DROWNING (UNDERWATER)<U+0001F602><U+0001F602>ALSO, IN THAT POOL..WHERE THEY ARE SHOOTING<U+0001F648><U+0001F62D><U+2764> #SidNaaz",TRUE
"1236021735016869898","Fri Mar 06 20:12:00 +0000 2020","I always had suicidal thoughts growing up.The day I became a father,I had a glowing warmth ""now I could commit suicide"" as there would be a part of me left behind,unlike my brother who passed away a few years before, with no children,which made his death harder.",TRUE
"1282091843040272384","Sat Jul 11 23:18:10 +0000 2020","I always start crying when speaking of colorism bro . Nobody understands how it feels to be bullied as a child cause nobody likes dark skins or secretly getting stereotyped as an adult cause dark skin is always associated with aggression and rudeness .",TRUE
"1281714751689687040","Fri Jul 10 22:19:44 +0000 2020","I always wondered why people complain about getting bullied for playing Aseop. Now I get it.To that Geisha and Feaster who bullied me, emoted and stuff. I hope at least that could give your pathetic life a meaning ;3",TRUE
"1283371464758976512","Wed Jul 15 12:02:55 +0000 2020","I am 100% against suicide but a lot of people in the Duterte government should put a gun on their mouths and pull the trigger.",TRUE
"1336831946048069632","Thu Dec 10 00:35:47 +0000 2020","I am Suicide Prevention Gatekeeper as organising an event a few year back. January 2017. Parents too felt in a save space. To confide to me about a son/daughter they did loose through suicide.This happened at an appointment in my own healing room more that once<U+0001F49F> ",TRUE
"1205415381029945344","Fri Dec 13 09:13:17 +0000 2019","I am going to commit suicide in 2020.  I thought I'd have the right to chose my own fucking destiny. I want to go to hell. It will be fucking better then being forced to be a lawyer or government employee or secretary. Fuck you GOP. You are 1984.",TRUE
"1338485612261814272","Mon Dec 14 14:06:52 +0000 2020","I am seeing tweets saying that people encouraged the lady to commit suicide and I honestly want to know where and how? They only called her out for somethings she said and she couldn’t stand in the house she set on fire.",TRUE
"1205582262521225216","Fri Dec 13 20:16:24 +0000 2019","I am verry stressed out right now. I told a kid on my buss""At least you don't want to fucking commit suicide"" then him and his dumbass friends started making jokes about it.",TRUE
"1205595455184351233","Fri Dec 13 21:08:50 +0000 2019","I am watching the crown. They make me sick. All they dois whine and complain. I am glad we don't have a monarch.Trump is enough to make you want to commit suicide.",TRUE
"1239167069461118977","Sun Mar 15 12:30:26 +0000 2020","I contemplate suicide everyday.I get very depressed since I struggle to at least create a track that sounds good to me.Then, people still want to push me over the edge which will either drive me to commit suicide or become a mass murderer or simply lose my mind.""Stay positive""",TRUE
"1283200449361989633","Wed Jul 15 00:43:22 +0000 2020","I decided I wasn’t going to be that girl anymore. I started to speak up for myself, but I was always “sarcastic” or “rude”. I always take what people say person, but I don’t show it. I go home and cry my heart out. I can tell you I’m still getting bullied, (2/?)",TRUE
"1337471861777567745","Fri Dec 11 18:58:35 +0000 2020","I didn’t grow up around a lot of white people. I was the minority on the block, getting bullied for being the little white girl on an Indian reservation, so I’m comfortable with talking about white/YT/wypipo <U+0001F602> but I definitely have always been judged for it.",TRUE
"1239264961580457984","Sun Mar 15 18:59:25 +0000 2020","I didn’t want to make it a big deal but March 3rd was my 1 year anniversary of when I tried to commit suicide. 1 year later and haven’t attempted since <U+0001F97A><U+263A><U+FE0F><U+0001F44D><U+0001F3FD>",TRUE
"1337929817434501125","Sun Dec 13 01:18:20 +0000 2020","I don’t even care lol I’m used to always getting shit for the colour of my skin, I used to get bullied and laughed at by boys when I was in school and I used to hate my skin so much, I literally don’t care anymore",TRUE
"1206134439237038080","Sun Dec 15 08:50:33 +0000 2019","I don’t want her to commit suicide ",TRUE
"1338624654299320322","Mon Dec 14 23:19:22 +0000 2020","I don’t want nobody to be sad but sometimes a nigga do really wanna commit suicide fr",TRUE
"1238996219982229505","Sun Mar 15 01:11:32 +0000 2020","I feel like Carrie. Bullied shitless and always getting pranks pulled on her as well and getting made fun of. Was an accident. and family is crazy!!! ",TRUE
"1338708037062832128","Tue Dec 15 04:50:42 +0000 2020","I feel like travis Scott is always getting bullied",TRUE
"1204119437722427392","Mon Dec 09 19:23:40 +0000 2019","I had Suicidal ThoughtsAnd i was always hurtingBut instead of killing myself I decided to Murder My Darkest burdens Now I Walk Alone ask the Lord what is my purposeMaybe you're not alone because there's always… ",TRUE
"1337440339053834240","Fri Dec 11 16:53:19 +0000 2020","I had a failed suicide attempt. Thankfully my life changed right after when I learned about meditation and it’s been my medicine since but meditation isn’t working right now. And NO I’m not having suicidal thoughts, I love my life and myself but I’m sinking into a very dark place",TRUE
"1338754146539855874","Tue Dec 15 07:53:56 +0000 2020","I had a jarring dream that someone I know commited suicide.If you're seeing this and you're having those thoughts, know that you can talk to me.I know life is hard. Trust me, I do.But sometimes, letting someone in on your struggles is all you need to feel a little lighter.",TRUE
"1338911921173565441","Tue Dec 15 18:20:52 +0000 2020","I had an ex-service user of mine reconnect with me recently and she told me that this intervention was a key factor in changing her thoughts about suicide and ultimately a big reason why she is still alive today... can’t thank these guys enough <U+0001F495> ",TRUE
"1236704555796135939","Sun Mar 08 17:25:17 +0000 2020","I had someone tell me that because I supported a different candidate, I didn’t care about people with mental health issues and I must want them to commit suicide. Which is ironic, because I have a mental illness and at times have had thoughts.",TRUE
"1283163735469826048","Tue Jul 14 22:17:29 +0000 2020","I had thoughts of killing myself earlier today...",TRUE
"1238494181116579840","Fri Mar 13 15:56:37 +0000 2020","I had to experience despair, I had to sink to the greatest mental depths, to thoughts of suicide, in order to experience grace.",TRUE
"1337819311545720833","Sat Dec 12 17:59:14 +0000 2020","I have attempted suicide more than once and have had periods of severe depression lasting months at a time. I have found that talking to friends and family helps, of course it does. But it doesn't stop the thoughts returning, and it doesn't make material prospects any less bleak",TRUE
"1204604591767248897","Wed Dec 11 03:31:29 +0000 2019","I have become fragmentednot ""put together""I have nothing REALinside..as it pertains to SOUL anymore.so suicide once more becomes a fixatation",TRUE
"1282828228273623044","Tue Jul 14 00:04:18 +0000 2020","I have had a low muse, a relapse in severe depression and thoughts of suicide, feeling overwhelmed being here SO I'M SORRY IF I DON'T FUCKING ANSWER ALL OF YOU I'M ONLY HUMAN ",TRUE
"1206316154207256576","Sun Dec 15 20:52:38 +0000 2019","I have left the book 'Don't be Sad' at MENTAL health hospital in Albany Lodge, St Albans, Hertfordshire who was RACIST to me all my life from Childhood then to call me schitzophrenia, what they want me to commit a suicide next?! NHS is sick to the CORE!!!",TRUE
"1337849259169886208","Sat Dec 12 19:58:14 +0000 2020","I havent actually had thoughts of suicide before. This is fucking scary",TRUE
"1283390953877901314","Wed Jul 15 13:20:22 +0000 2020","I joined because of the many unintentional shootings and suicide by gun that are killing our youth. At we learn to teach #ResponsibleStorage. Join me. Text READY to 644-33. #NM #nmpol ",TRUE
"1206329990117281794","Sun Dec 15 21:47:36 +0000 2019","I just can't imagine myself in another career, this is what i want to do. The standards of the school are really high and it's making me nervous that i have an important exam in January, exact the day when i tried to commit suicide this year. (14.01./15.01)",TRUE
"1283202055767638017","Wed Jul 15 00:49:45 +0000 2020","I just have a feeling she’s gonna “commit suicide”... she knows a lot of information that can take big names out of power. They wouldn’t want her to testify. #ConspiracyTheory ",TRUE
"1338189206972227584","Sun Dec 13 18:29:03 +0000 2020","I just hope people are not playing with suicide. Words are powerful. Thoughts too are powerful. Yes we have all had break downs at different times.Please, don't abuse the term all the name to drive traffic to your TL.... God bless you.",TRUE
"1205408547233615873","Fri Dec 13 08:46:07 +0000 2019","I just really want to commit suicide. So so so sofreakjng bad man",TRUE
"1205125131808456704","Thu Dec 12 13:59:56 +0000 2019","I keep thinking I should tweet something else to remind everyone of the unmitigated catastrophe will continue to be if he’s elected. But I’ve said it all, more than once. So that’s it. If you’re not rich &amp; you vote Tory now, your X should be seen as a suicide note.",TRUE
"1236506449771143169","Sun Mar 08 04:18:05 +0000 2020","I kinda know how she felt about suicide cause once i really was about to suicide , but in the last moment i was very sacred to do it .However , we should give more awareness about depression and how we can stop the suicide .",TRUE
"1283199700779270144","Wed Jul 15 00:40:24 +0000 2020","I know I keep my page positive, and I try it be there for everyone who goes through a tough time, but lately I feel like my past comes to haunt me. I use to be this girl getting bullied, always quiet, taking everything personally. I’m still that girl but (1/?)",TRUE
"1282250023074324481","Sun Jul 12 09:46:43 +0000 2020","I know I’m not supposed to laugh, but I can’t help it. Minguk is soooo cute here despite Seoeon pulling his ear. <U+0001F648>Poor Minguk though. Always being bullied and always getting into accidents. ",TRUE
"1238406294647775234","Fri Mar 13 10:07:23 +0000 2020","I know all about it because I have attempted it more than once. I understand the darkness and despair. I also try to tell them that God loves them and they have a purpose. Suicide just distributed all your pain to the loved ones you leave behind. #SuicidePrevention",TRUE
"1237143088998559750","Mon Mar 09 22:27:52 +0000 2020","I know people do this same schedule but with work and school but I literally had thoughts about killing myself last week. I dont think I can handle this",TRUE
"1205163994379640835","Thu Dec 12 16:34:21 +0000 2019","I lost a dear friend to suicide last week and being on ed twt with so many people mentioning how they want to commit just breaks my heart. I wish I could have done more...please check on each other",TRUE
"1337355223614930944","Fri Dec 11 11:15:06 +0000 2020","I love BTS more than my life cuz once time their music,their songs was save my life from suicide <U+0001F642> I can realize that how can I love myself and how important I am in my life so this is a big thing what I have from BTS.This things people can't find easily so I love BTS and ARMY<U+0001F49C> ",TRUE
"1283174464172302337","Tue Jul 14 23:00:07 +0000 2020","I may look perfectly fine but deep down inside me i want to commit suicide and runaway<U+0001F62A><U+0001F62A>",TRUE
"1236472411563995138","Sun Mar 08 02:02:50 +0000 2020","I need this mr beast I'm always getting bullied that I have a Samsung and my friend have iPhones so this will mean the world to me.",TRUE
"1202481464987680769","Thu Dec 05 06:54:56 +0000 2019","I once carved: ""a cut for help"" into my left arm.<U+0938><U+0902><U+0938><U+093E><U+0930><U+300C>sa<U+1E43>sara<U+300D>I fathom much better now though I am pretty sure more than once I ""bought the farm"".The quantum suicide and immortality paradox?Is a retrocausality laden nightmare that I now wish would kick rocks. ",TRUE
"1238220296475136000","Thu Mar 12 21:48:18 +0000 2020","I overstepped my bounds with . They sent me an immediate notice of a violation. I said something that insinuated death or suicide in a joking way. Let me be clear though. I didn't pull a #Madonna and say, ""I've thought about blowing up the Whitehouse more than once.""",TRUE
"1283448678733185024","Wed Jul 15 17:09:44 +0000 2020","I pray for all depressed people to be happy one day. I also pray for those who want to commit suicide, that they don’t do it and find help immediately.",TRUE
"1337865725873045504","Sat Dec 12 21:03:40 +0000 2020","I promised to talk about troubled kids and suicide. It’s taken me a while to pull my thoughts together on this. Those of you who know me know that I had a seriously mentally ill son who ultimately shot himself. Since then, I have found out what it means to be so",TRUE
"1206301588786204674","Sun Dec 15 19:54:45 +0000 2019","I really want to commit Suicide",TRUE
"1338675412034056193","Tue Dec 15 02:41:04 +0000 2020","I really want to commit suicide",TRUE
"1338488531895922688","Mon Dec 14 14:18:28 +0000 2020","I really want to know what goes through peoples mind when they try to commit suicide... like is the love you have for yourself not enough?!? Is there not someone you care for or love more ?!?",TRUE
"1282259517309218818","Sun Jul 12 10:24:26 +0000 2020","I remember being a lonely ass and a sad ass kid in elementary always getting bullied and beat up smhhh racist ass kids",TRUE
"1338240690606776320","Sun Dec 13 21:53:38 +0000 2020","I remember when I wanted to commit suicide and the devil said: ""Why do you want to end your life when there are a lot of things out there to enjoy? Keep yourself alive and happy even if it is at the expense of other people's happiness""",TRUE
"1338244031374045184","Sun Dec 13 22:06:55 +0000 2020","I rt’d something yesterday on twitter. It says that when someone says they want to commit suicide, we should be gentle and kind. You guys weren’t kind.",TRUE
"1282766827479867395","Mon Jul 13 20:00:18 +0000 2020","I showed you love and I had thoughts of killing myself, I was damaged..",TRUE
"1235733780981100544","Fri Mar 06 01:07:46 +0000 2020","I showed you love when I had thoughts of killing myself",TRUE
"1283460352827469824","Wed Jul 15 17:56:08 +0000 2020","I spoke with about a new report from .""Our society has a long way to go to create a safer and more affirming environment for #LGBTQ youth. We once again see the devastating mental health consequences of our failures.""",TRUE
"1239266258345955329","Sun Mar 15 19:04:35 +0000 2020","I swear to god everytime I hear cardi b speak I want to commit suicide. Stupid bitch is annoying as fuck",TRUE
"1238418065852899328","Fri Mar 13 10:54:10 +0000 2020","I think I fw Kim Possible because she was always the HBIC like Bonnie was just a hater all them other shows bitches was just getting bullied .",TRUE
"1239213242725081088","Sun Mar 15 15:33:55 +0000 2020","I told my dad that I want to commit suicide. He didn’t take it well.",TRUE
"1338239973678600194","Sun Dec 13 21:50:47 +0000 2020","I used to feel it’s somehow or clout chasing when someone post that “they are bout to commit suicide or relating to suicide”Over time I realized ,they may want to commit the suicide as a last resort but they are not happy they will have to leave that way..hence they try to see",TRUE
"1283394493354586112","Wed Jul 15 13:34:26 +0000 2020","I volunteer with and to reduce the enormous toll gun #suicide takes on families.  My Army MSGT dad was 51 when he shot himself in 1965.  My son, just 25 in 2012. Keep guns away from anyone in crisis. Text READY to 644-33 #MDpolitics ",TRUE
